78	tongue 	నాలుక (nāluka)	na.ⲗⲁⲥ 'licker’ [g]lisso 'snake’	+?	నాలుక (nāluka) 	𓄓, 𓄓 𓄻 𓏤, 𓈖 𓄓 𓋴 𓄻, 𓈖 𓄓 𓋴 𓄻 2. 𓊃 𓈖 𓎡 𓄓, 𓊃 𓈖 𓎡 𓄓 2b. 𓈙 𓋴 𓐟 𓄿 𓅱 𓄓 𓏤 2c. 𓍱 𓊃 𓂋 𓄓	நாக்கு (nākku) 	നാക്ക് (/n̪aːkkɨ̆/), നാവ് (/n̪aːʋɨ̆/), മൊഴി (/moɻi/) 	ನಾಲಗೆ 	 	 	 	 (dûî)
79	fingernail 	గోరు (gōru), நகம் (nagam)	Kralle>köröm Nagel	+++	గోరు (gōru) 	𓋁 𓃀 𓌟 𓄹 𓏤	நகம் (nagam) 	 () 	ಉಗುರು 	 	 	 	
80	foot 		పాదము (pādamu), అడుగు (aḍugu) 	+++	పాదము (pādamu), అడుగు (aḍugu) 	𓃀, 𓂾, 𓂾𓏏𓄹, 2. 𓂋 𓂧 𓂾 ~ 𓅱 𓂝 𓂋 𓏏𓂾 	அடி (adi), பாதம் 	അടി (/aʈi/), കാലടി (/kaːlaʈi/) 	ಅಡಿ 	 	 	 	
81	leg 	కాలు (kālu) 	Kehleg 	:	కాలు (kālu) 	𓃀, 𓂾, 𓃛 𓂝 𓄯, 𓃛 𓅱 𓂝 𓅱 𓄯 𓄹	கால் (kāl) 	കാല് (/kaːlɨ̆/), കാൽ- (/kaːl-/) 	ಕಾಲು 	 	 	 	
82	knee 	మోకాలు (mōkālu) 	Kehle	~++?	మోకాలు (mōkālu) 	𓊪 𓂧 𓂾 𓄹, 2. 𓌳 𓋴 𓏏𓂾 , 𓌳 𓄿 𓊨 𓏏𓂾	மூட்டு (mooṭṭu) 	മുട്ട് (/muʈʈɨ̆/) 	ಮಂಡಿ 	 	 	 	
83	hand 	கை (kai)	khand, kaf, käsi@Uralic …	+++<<	చెయ్యి (ceyyi), చేయి (cēyi) 	𓂝 𓏤, 𓂧 𓏏 𓏤, 𓇥 𓂋 𓏏 𓂧, 𓍑 𓏏 𓂩	கை (kai) 	കൈ (/kaɪ/) 	ಕೈ 	 	 	 	 (dû)
84	wing 	இறக்கை (irakkai)	Icar = [Fl]ight @ TURK	<	రెక్క (rekka) 	𓂧 𓈖 𓎛 𓆃, 𓂧 𓌳 𓏏 𓆃, 𓆓 𓈖 𓎛 𓆃, 𓂧 𓃀 𓄏	இறக்கை (irakkai) 	ചിറക് (/t͡ʃiɾakɨ̆/) 	ರೆಕ್ಕೆ 	 	 	 	 (bâl)
85	belly 	పొట్ట (poṭṭa), కడుపు (kaḍupu)	pott=belly botton@SEM	++;)	పొట్ట (poṭṭa), కడుపు (kaḍupu) 	"𓄡, 𓄡 𓏏 𓏤	, 𓄡 𓂂 𓏏"	தொந்தி(tonthi) 	വയറ് (/ʋajaɾɨ̆/), വയർ (/ʋajaɾ/), പള്ള (/paɭɭa/), വട്ടി (/ʋaʈʈi/), പേറ്റ് (/peːrrɨ̆/) 	ಹೊಟ್ಟೆ 	 	 	 	
86	guts 			--- BODY PARTS ---	పేగులు (pēgulu) 	𓄤?	குடல் (kudal) 	കുടല് (/kuʈalɨ̆/), കുടൽ (/kuʈal/) 	ಕೆಚ್ಚು (keccu) 	 	 	 	
87	neck 			/	మెడ (meḍa), కంఠం (kaMṭhaM) 	"𓄈, 2. 𓐍 𓐍 𓄈, 3. 𓄊 𓏏 𓏤 𓄻  4. 𓋭 𓅿	 5. 𓃀 𓂝 𓈖 𓏏 𓄻  𓅿  "	கழுத்து(kazhuthu) 	കഴുത്ത് (/kaɻut̪t̪ɨ̆/) 	ಕತ್ತು 	 	 	 	
88	back 				వీపు (vīpu), వెన్ను (vennu) 	𓊪 𓊃 𓂧, 𓄻 𓄩 𓄦 𓄹, 𓊪 𓋴 𓆓 𓄪 𓄪 𓄪, 𓊪 𓂧 𓋴 𓅱 𓄪 𓏤, 𓇋 𓄿 𓏏 𓄦 𓏏 𓄻, 𓐟 𓏤, 𓐠 𓏤	முதுகு (muthugu) 	പുറം (/puram/), മുതുകു് (/mut̪ukɨ̆/) 	ಬೆನ್ನು 	 	 	 	
89	breast 			---	చన్ను (cannu), స్తనము (stanamu) 	0. 𓏏𓏏 1. 𓃀 𓏏 𓄹, 𓃀 𓅌 𓏏,  𓅌 𓏏, 2. 𓈎𓄿𓃀𓏏𓄹, 3. 𓍲 𓈖 𓃀 𓏏 𓄹, 𓍲 𓈖 𓃀 𓅌 𓏏 𓂒, 4. 𓏠 𓈖 𓂧 𓂒	மார்பு (mārbu), (mulai) 	മുല (/mula/), അമ്മിഞ്ഞ (/ammiɲɲa/), നെഞ്ച് (/n̪ent͡ʃɨ̆/) (chest) 	ಮೊಲೆ 	 	 	 	
90	heart 	ithayam 		---, ~	గుండె (guMḍe) 	𓎛 𓄿 𓏏 𓏮 𓄣, 𓄂 𓏏 𓏮 𓄣, 𓇉 𓏏 𓄣, 𓄣 𓏤, 𓄤 𓏤	உள்ளம் (uḷḷam), ithayam 	ചങ്ക് (/t͡ʃaŋkɨ̆/), കൂമ്പ് (/kuːmpɨ̆/), ഉള്ള് (/uɭɭɨ̆/) 	ಗುಂಡಿಗೆ 	 	 	 	
91	liver 	ஈரல்(īral)  കരൾ (/kaɾaɭ/) 	viral Coeur	~+	కాలేయం (kālēyam) 	𓅓 𓊃 𓏏 𓄹 𓈓 , 𓏇 𓇋 𓋴 𓏏 𓄹 𓏤 , 𓈘 𓈇 𓋴 𓏏 𓄹 	ஈரல்(īral) 	കരള് (/kaɾaɭɨ̆/), കരൾ (/kaɾaɭ/) 	ಈಲಿ 	 	 	 	
92	to drink 		s’agua കുടി (/kuʈi/)~ici@TURK	~+?	తాగు (tāgu) 	𓃀 𓂝 𓃀 𓂝 𓀢 , 𓃀 𓂝 𓃀 𓂝 𓈗 , 2. 𓏏 𓐍 𓏌 3. 𓋴 𓏴 𓂋 𓇋 𓈗 𓏲 𓂧 𓆑 𓂻, 𓋴 𓅨 𓂋 𓇋 𓈗 𓀁, 𓊃 𓅨 𓂋 𓏊 4. 𓊃 𓃀 𓇋 𓀁 	குடி (kudi) 	കുടി (/kuʈi/) 	ಕುಡಿ 	 	 	 	
93	to eat 		i’tin	~+?	తిను (tinu) 	𓅱 𓈙 𓂝 𓄑 𓀁, 𓃹 𓈖 𓅓 𓀁 2. 𓏘 𓏘 𓀁 3. 𓏶 𓀁, 𓇬 𓀁, 𓏶 𓅓 𓀁  	உண் (oon), (thin) 	കഴി (/kaɻi/), തിന്ന് (/t̪innɨ̆/), ഉണ്ണ് (/uɳɳɨ̆/) 	ತಿನ್ನು, ಉಣ್ಣು 	 	 	 	
94	to bite 	கடி (kadi)	Cut ,kau	~+?	కొరుకు (koruku), కరచు (karacu) 	𓊪 𓊃 𓎛 𓄑 𓀁 	கடி (kadi) 	കടി (/kaʈi/) 	ಕಡಿ 	 	 	 	
95	to suck 		చీకు (cīku)  cus=suc=joice	~+	చీకు (cīku) 	𓋴 𓈖 𓈎 𓂒, 𓋴 𓈖 𓏘 2. 𓎡 𓆑 𓆑 𓂐 	உறிஞ்சு (urinju), (uri) 	ഈമ്പ് (/iːmpɨ̆/), ചപ്പ് (/t͡ʃappɨ̆/) 	ಚೀಪು 	 	 	 	
96	to spit 	துப்பு thuppu ⲑⲁϥ , ⲑⲏϥ tafʾa 	ఉమ్ము ([v]ummu[t]) 	~?	ఉమ్ము (ummu) 	𓃀 𓈙 𓂐, 𓊪 𓋴 𓎼 𓂐, 𓊪 𓊃 𓎼 𓄑 𓀁 2. 𓏏 𓈙 𓂐 	துப்பு (thuppu) 	തുപ്പ്‌ (/t̪uppɨ̆/) 	ಉಗುಳು 	 	 	 	
97	to vomit 		kak=bad	;)	కక్కు (kakku) 	𓋴 𓃀 𓈙 𓇋 𓇋 𓂐 2. 𓈎 𓄿 𓋴 𓀁, 𓈎 𓇋 𓋴 𓀁, 𓈎 𓂝 𓂐, 𓈎 𓄿 𓂝 𓀁 3. 𓃀 𓈙 𓅱 𓂐 𓏥, 𓋴 𓈎 𓂝 𓂐, 𓈎 𓄿 𓂝 𓀁,  	கக்கு (kakku) 	കക്ക് (/kakkɨ̆/), കമട്ട് (/kamaʈʈɨ̆/), ഛർദിക്ക് (/t͡ʃʰaɾd̪ikkɨ̆/) 	ಕಾರು 	 	 	 	
98	to blow (as wind) 	వీచు (vīcu)	Wud ~ wind < blasen	!? ONO	ఊదు (ūdu) (transitive), వీచు (vīcu) (intransitive) 	𓋴 𓐍 𓏏 𓀜 	ஊது (ūthu) 	ഊത് (/uːt̪ɨ̆/) (transitive), വീശ് (/ʋiːɕɨ̆/) (intransitive) 	ಊದು 	 	 	 	
99	to breathe 				ఊపిరి పీల్చు (ūpiri pīlcu) 	𓋴 𓈖 𓂉 𓀁, 𓋴 𓈖 𓆑 𓊡 𓀜, 𓊃 𓈖 𓆑 𓏮 𓊡, 𓋴 𓋴 𓈖 𓂉, 𓋴 𓋴 𓏏 𓂉, 𓋴 𓌢 𓈖 𓂉, 𓌢 𓈖 𓂉 2. 𓋴 𓂋 𓈎 𓏛 3. 𓍿 𓊪 𓇋 𓂉, 𓏏 𓊪 𓂋 𓂊 𓏏 𓊪 𓇋 𓂉 𓂡 4. 𓐍 𓈖 𓌰 𓅓 𓂉 𓀁 5. 𓂝 𓅓 𓄈 𓀁 	மூச்சுவிடு (moochuvidu) 	 	ಉಸಿರು+ಆಡು 	 	 	 	
100	to laugh 	Nagai 	~ lache, necke		నవ్వు (navvu) 	𓋴 𓃀 𓇋 𓏏 𓎸 𓄑 	சிரி (ciri), (nagai) 	ചിരി (/t͡ʃiɾi/) 	ನಗು 	 	 	 	
101	to see 	చూచు (cūcu)  காண் (kāṇ)	Guck +++ ceen ^ eye	+++	చూచు (cūcu) 	𓊪 𓏏 𓂋 𓇋 𓁻 2. 𓂧 𓎼 𓄿 𓇋 𓇋 𓁼, 𓂧 𓎼 𓁹, 𓂧 𓎯 3. 𓌴 𓁹 𓄿 𓄿, 𓌵 4. 𓈖 𓍇 𓏌 𓁹, 𓈖 𓍯 𓄿 𓁺 	காண் (kāṇ) 	കാണ് (/kaːɳɨ̆/) 	ನೋಡು 	 	 	 	
102	to hear 	கேள் (kēḷ)	Kher ~ kel	~+	విను (vinu) 	𓄔, 𓄔 𓏛, 𓄔 𓅓, 𓋴 𓅓 𓄔, 𓋴 𓅓 𓂸 𓏏 𓄔, 𓋴 𓂸 𓏏 𓄔 	கேள் (kēḷ) 	കേൾക്ക് (/keːɭkkɨ̆/) 	ಕೇಳು 	 	 	 	
103	to know (a fact) 	அறி (aṟi) 		<	తెలుసుకొను (telusukonu), ఎరుగు (erugu) 	𓂋 𓐍, 𓂋 𓐍 𓏜 𓅓, 𓂝 𓂋 𓈎 𓍼 𓂋 𓏏, 2. 𓋴 𓐟 𓄿 𓇋 𓋷 𓀁, 𓋷 𓀁 3. 𓊃 𓈙 𓄿 𓏜, 𓈙 𓊃 𓐠 𓄿 𓄃 𓏛 4. 𓄈, 𓂝 𓅓 𓄈 𓀁 5. 𓉲	அறி (aṟi) 	അറിയ് (/arijɨ̆/) 	ತಿಳಿ 	 	 	 	
104	to think 	ఆలోచించు (ālōcincu)	al cinc = think <> an cinc <> cinc 𓎡 𓄿 𓏮 𓀁	++?	ఆలోచించు (ālōcincu) 	𓇋 𓃀 𓀁 2. 𓈖 𓎡 𓏮 𓀁, 𓈖 𓎡 𓄿 𓏮 𓀁 3. 𓋴 𓆼 𓄿 𓀁, 𓋴 𓐍 𓆼 𓄿 𓀁 4. 𓎡 𓄿 𓀁	நினை (niṉai) 	നിനയ്ക്ക് (/n̪inajkkɨ̆/)   𓈖 𓎡 𓏮 𓀁, 𓈖 𓎡 𓄿 𓏮 𓀁	ಯೋಚಿಸು 	 	 	 	
105	to smell (sense odor) 	நுகர் (nugar) 𓋴 𓈖 𓂉 𓀁 వాసన చూచు (vāsana cūcu)	<> nose		వాసన చూచు (vāsana cūcu), మూచ్చూచు (mūccūcu) 	𓌢 𓂉, 𓋴 𓈖 𓂉 𓀁, 𓋴 𓋴 𓂉, 𓋴 𓋴 𓈖 𓂉, 𓋴 𓋴 𓏏 𓂉 2. 𓐍 𓈖 𓌰 𓐝 𓏮 𓊸 𓏥, 𓐍 𓈖 𓌰 𓂉 𓏥, 𓐍 𓈖 𓌰 𓅓 𓂉 𓀁 	நுகர் (nugar) 	മണക്ക് (/maɳakkɨ̆/) 	ಮೂಸು 	 	 	 	
106	to fear 	బెదురు (beduru)  𓅾 𓏏 𓏤	bhe’ur <> feather ?	~?	బెదురు (beduru), భయపడు(bhayapaḍu) 	𓆂 𓏥, 𓅾 𓏏 𓏤 , 𓆓, 𓊃 𓈖 𓆓 𓏏 𓅾 2. 𓈖 𓂋 𓂡 𓈖 𓂋 𓅱 𓅐 𓀜 𓏪,  𓈖 𓂋 𓅱 𓆂 𓂡 𓏥 3. 𓈖 𓅐 𓂝 4. 𓋴 𓂋 𓅾	அஞ்சு (añju) 	പേടിക്ക്‌ (/peːʈikkɨ̆/) 	ಹೆದರು 	 	 	 	 (xuliis)
107	to sleep 	కునుకు (kunuku), నిద్ర పోవు (nidra pōvu) 	Knacke Knarzen , nieder pofen ;)		కునుకు (kunuku), తూగు (tūgu), 	𓁀, 𓈖 𓌰 𓅓 𓂝 𓁀 2. 𓋴 𓇥 𓂋 𓁀 3. 𓂝 𓂝 𓅱 𓏮 𓁺, 𓂝 𓂝 𓅂 4. 𓐪 𓂧 𓂧 𓏌 𓁼  	தூங்கு (tūṅgu) 	ഉറങ്ങ്‌ (/uraŋŋɨ̆/), ചായ് (/t͡ʃaːjɨ̆/) (from repose), ചരിയ് (/t͡ʃaɾijɨ̆/) (from repose) 	ಮಲಗು 	 	 	 	
108	to live 	வாழ் (vāḻ) വാഴ് (/ʋaːɻɨ̆/)	Vital <> vir	~+-	బతుకు (batuku) 	𓋹 𓈖 𓐍, 𓋴 𓋹 𓈖 𓐍	வாழ் (vāḻ) 	വാഴ് (/ʋaːɻɨ̆/) 	ಬಾಳು 	 	 	 	
109	to die 	చచ్చు (caccu)  𓀐 𓏏	Cesse, cede <> kaka:black/bad?	~+	చచ్చు (caccu) 	𓅓 𓏱 𓏏, 𓅓 𓏏 𓁀, 𓅓 𓏏 𓂂, 𓅓 𓏏 𓀐, 𓀐 𓏏, 2. 𓋴 𓏲 𓍑 𓄿 𓏱  	சா (cā) 	ചാക് (/t͡ʃaːkɨ̆/) 	ಸಾಯಿ 	 	 	 	
110	to kill 	கொல் (kol) 	kill < q'tol @ SEM	+++	చంపు (caMpu) 	𓌪 𓂝, 𓄡 𓂧 𓃀 𓀜 2. 𓂧 𓈖 𓌪 3. 𓄡 𓂧 𓃀 𓀜 4. 𓅱 𓎛 𓋴 𓌪 𓂡 5. 𓊃 𓌳 𓄿 𓌏 6. 𓋴 𓂝 𓂋 𓈎 𓍼 𓌪 𓂡 7. 𓋴 𓌳 𓄿 𓌪 𓅓 𓌪 𓂝 	கொல் (kol) 	കൊല്ല് (/kollɨ̆/) 	ಕೊಲ್ಲು 	 	 	 	 (kasf-)
111	to fight 	పోరాడు (pōrāḍu) 𓇋 𓎛 𓄿 𓂝	Phoirad <> sport	~	పోరాడు (pōrāḍu) 	𓂚 𓀜, 𓂚 𓄿 𓀜, 𓇋 𓎛 𓄿 𓂝, 𓂝 𓎛 𓄿 2. 𓈙 𓆑 𓂝 𓂡 	சண்டைப் போடு (saṇdai pōdu), (poradu) 	പൊരുത് (/poɾut̪ɨ̆/), പോരാട് (/poːɾaːʈɨ̆/) 	ಹೋರಾಡು 	 	 	 	
112	to hunt (transitive) 		vettern?		వేటాడు (vēṭāḍu) 	𓃀 𓎛 𓋴 𓂾 2. 𓍿 𓉔 𓅓 𓂻 3. 𓈖 𓍇 𓄟 𓄠 𓋤 4. 𓎼 𓂋 𓍅 𓏲 𓀜 	வேட்டையாடு (veettaiyaadu) 	നായാട് (/n̪aːjaːʈɨ̆/), വേട്ടയാട് (/ʋeːʈʈajaːʈɨ̆/) 	ಬೇಟೆಯಾಡು 	 	 	 	
113	to hit 		కొట్టు (koṭṭu) 	~++ <>	కొట్టు (koṭṭu) 	𓋴 𓐍 𓀜, 𓊃 𓐍 𓂬, 𓀝 𓂝, 𓎡 𓏏 𓎡 𓏏 𓏴 𓂡, 	அடி (adi), தாக்கு (thaaku) 	തല്ല് (/t̪allɨ̆/), അടിക്ക് (/aʈikkɨ̆/), അടി (/aʈi/), തട്ട് (/t̪aʈʈɨ̆/), കൊട്ട് (/koʈʈɨ̆/) 	ಹೊಡೆ 	 	 	 	
114	to cut 		കോത് (/koːt̪ɨ̆/) 	+++ … ?	కోయు (kōyu) 	𓍉, 𓁸, 𓏴 𓌪 𓂡, 𓂧 𓌪, 2. 𓂧 𓈖 𓌪, 𓂧 𓅁 𓌪 𓂡	வெட்டு (veṭṭu), (koithu) 	മുറിക്ക് (/murikkɨ̆/), വെട്ട് (/ʋeʈʈɨ̆/), കോത് (/koːt̪ɨ̆/) (lop off), കൊയ്യുക (/kojjuka/) (for harvesting), ചെത്ത് (/t͡ʃet̪t̪ɨ̆/) (trim or slice off), പൂള് (/puːlɨ̆/) (slice), അരി (/aɾi/) (chop) 	ಕತ್ತರಿಸು 	 	 	 	
115	to split 	చీల్చు (cīlcu)பிள (pila)		~+	చీల్చు (cīlcu) 	𓊪 𓈙 𓈖 𓌫 𓆱, 2. 𓏏 𓈙 𓏴 𓂡, 𓏏 𓆷 𓏴 𓂝 	பிள (pila) 	പിളർക്ക് (/piɭaɾkkɨ̆/), പൂള് (/puːlɨ̆/) (slice) 	ಸೀಳು				
116	to stab (or stick) 		Cut / pod	+	పొడుచు (poḍucu), కుచ్చు /kuɕːu/ 	𓋴 𓂧 𓃀 𓉽 𓏴 	குத்து(kuthu) 	കുത്ത് (/kut̪t̪ɨ̆/) 	ಇರಿ 	 	 	 	
117	to scratch (an itch) 		சொரி (sori) 	~++	గీరు (gīru) 	𓎗 𓌗 𓂋, 𓄿 𓄡 𓂝 𓂷, 2. 𓊪 𓅮 𓐍 	சொரி (sori) 	ചൊറിയ് (/t͡ʃorijɨ̆/), മാന്ത് (/maːn̪t̪ɨ̆/) 	ಕೆರೆ 	 	 	 	
118	to dig 			<<	తవ్వు (tavvu) 	𓄞 𓂧 𓀜, 𓆷 𓂧 𓂡, 𓆷 𓄿 𓂧 𓁃, 𓆷 𓄿 𓂧 𓂡 	தோண்டு (thondu) 	കുഴിക്ക് (/kuɻikkɨ̆/), തോണ്ട് (/t̪oːnʈɨ̆/), മാന്ത് (/maːn̪t̪ɨ̆/) 	ತೋಡು 	 	 	 	
119	to swim 	ఈదు (īdu)	vhita, naun <> turk/hun	+?	ఈదు (īdu) 	𓈖 𓃀 𓀒 𓈗, 𓈖 𓎟 𓃀 𓈗, 𓈖 𓋞 𓃀 𓈗 	நீந்து (neenthu) 	നീന്ത് (/n̪iːn̪t̪ɨ̆/) 	ಈಜು 	 	 	 	
120	to fly 		பற (paṟa)  icaru@turk/hun	++<<	ఎగురు (eguru) (intransitive), ఎగరవేయు (egaravēyu) (transitive) 	𓂝 𓄡 𓅯, 𓂝 𓄡 𓆃 , 𓂝 𓄡 𓌙 𓅯, 𓇋 𓍿 𓍿 𓅮 1b. 𓇋 𓏏 𓏏 𓅯 2. 𓂝 𓊪 𓆃	பற (paṟa) 	പറക്ക് (/parakkɨ̆/) 	ಹಾರು 	 	 	 	
121	to walk 		Ante …?	?	నడుచు (naḍucu) 	1. 𓈝 𓅓 𓂻  2. 𓂧 𓎼 𓄿 𓂾 𓁺, 𓂧 𓎼 𓄿 𓋴 𓁺 3. 𓋴 𓏏 𓅱 𓏏 𓂻, 𓋴 𓅱 𓅱 𓏏 𓏏 𓂻, 𓐠 𓏤 𓏏 𓅱 𓊗 𓏮 𓂻 	நட (nada) 	നടക്ക് (/n̪aʈakkɨ̆/), നട (/n̪aʈa/) 	ನಡೆ 	 	 	 	
122	to come 		வா (vā)  walk	++ >>	వచ్చు (vaccu) 	𓇍, 𓇍 𓇋 𓇋 𓂻, 𓄭 𓂻, 𓂻 𓂽, 𓂝 𓈖 𓈖 𓂽 	வா (vā) 	വരുക (/ʋaɾuka/), വാ (/ʋaː/) 	ಬಾ 	 	 	 	 (banning)
123	to lie (as on one's side) 		beine strecken?		పడుకొను (paḍukonu) 	𓋴 𓇥 𓂋 𓁀	கிட (kida), (padu) 	കിടക്ക് (/kiʈakkɨ̆/), കിട (/kiʈa/), ചായ് (/t͡ʃaːjɨ̆/) (repose; from lean to a side), ചരിയ് (/t͡ʃaɾijɨ̆/) (repose; from lean to a side) 	ಪಡು 	 	 	 	
124	to sit 				కూర్చొను (kūrconu) 	𓎛 𓈞 𓋴 𓀉, 𓈞 𓊃 𓀉, 𓋴 𓇛 𓅓 𓀼, 𓍿 𓋴 𓀉, 2. 𓎛 𓂧 𓃀 𓂻, 𓎛 𓆑 𓂧 𓀉  	உட்கார் (uṭkār) 	ഇരിക്ക് (/iɾikkɨ̆/), ഇരി (/iɾi/) 	ಕೂರು 	 	 	 	
125	to stand 	నిలబడు (nilabaḍu)	Nil’baden ;)	!?	నిలుచొను (niluconu), నిలబడు (nilabaḍu) 	𓊢,𓊣, 𓊢 𓂝 𓂻, 𓋴 𓊢 𓂝 𓂻 2. 𓋴 𓏠 𓈖 𓍖 𓂝 	நில் (nil) 	നിൽക്ക് (/n̪ilkkɨ̆/), നിക്ക് (/n̪ikkɨ̆/) 	ನಿಲ್ಲು 	 	 	 	
126	to turn (change direction) 	തിരി (/t̪iɾi/)	തിരി (/t̪iɾi/)  tip’ing point	++ …	తిప్పు (tippu) (transitive), తిరుగు (tirugu) (intransitive) 	𓄲 𓂋 𓂻, 𓊪 𓄵 𓂋, 𓊪 𓈖 𓂝 𓈖 𓂝 𓊜, 𓊜, 𓅱 𓆓 𓃀 𓈅, 𓄟 𓋴 𓃀 𓃀 𓀁, 𓄟 𓋴 𓈖 𓎛 𓂽, 𓅓 𓂟 𓎡 𓇉 𓁶, 𓂋 𓂞 𓐟 𓏤 𓈖, 𓁷 𓏤 𓐟 𓏤, 𓈄 𓃀, 𓎗 𓃀 𓄲 𓂻, 𓎗 𓃀 𓈅 𓂽, 𓏏 𓈖 𓃀 𓄡 𓂻, …  	திரும்பு (thirumbu) 	തിരി (/t̪iɾi/) 	ತಿರುಗು 	 	 	 	 ('ars-)
127	to fall (as in drop) 		^^ lie	<<	పడు (paḍu) 	𓀒 , 𓐍𓂋𓀒  	விழு (vizhu) 	വീഴ് (/ʋiːɻɨ̆/) 	ಬೀಳು 	 	 	 	
128	to give 	தா (thā)	தா (thā)	~	ఇచ్చు (iccu) 	1. 𓂧 𓅱 𓂡, 𓂝, 𓏙 2. 𓂋 𓂞, 𓂋 𓏙, 𓏙 	தா (thā) 	താ (/t̪aː/), തരുക (/t̪aɾuka/), കൊട് (/koʈɨ̆/), നൽക് (/n̪alkɨ̆/) 	ಕೊಡು 	 	 	 	
129	to hold (in one's hand) 		𓂘 con	!?	పట్టుకొను (pattukonu) 	𓈖 𓇥 𓂋 𓀜, 𓈖 𓇥 𓂡, 2. 𓂧 𓈖 𓇋 𓏯 𓂡, 𓂧 𓈖 𓇋 𓍸 𓀜 	கொள் (koḷ), பிடி (pidi) 	പിടി (/piʈi/), പിടിക്ക് (/piʈikkɨ̆/) 	ಹಿಡಿ 	 	 	 	
130	to squeeze 	கசக்கு (kasakku)	quetch	~	పిసుకు (pisuku) 	𓋴 𓄡 𓈖 𓎡 𓍱 𓀜, 𓋴 𓆞 𓄿 𓎡 𓀜, 𓇋 𓂝 𓆑, 𓂝 𓂝 𓆑 𓏲 𓂡, 𓈖 𓍇 𓏌 𓂧 	கசக்கு (kasakku), (pisuku) 	ഞെക്ക് (/ɲekkɨ̆/), ഞെരുക്ക് (/ɲeɾukkɨ̆/), പിഴി (/piɻi/) 	ಹಿಚುಕು 	 	 	 	
131	to rub 	రుద్దు (ruddu) 	rud	~	రుద్దు (ruddu) 	𓋴 𓇋 𓆛 𓈖 𓏲 𓂡, 𓊃 𓇋 𓈖 𓂝 	தேய் (thei) 	ഉരയ്ക്ക് (/uɾajkkɨ̆/), തൂക്ക് (/t̪uːkkɨ̆/), തലോട് (/t̪aloːt̪ɨ̆/), തേയ്ക്ക് (/t̪eːjkkɨ̆/) 	ಉಜ್ಜು 	 	 	 	
132	to wash 	:	<> Turk/hun ?	??	కడుగు (kaḍugu) 	𓇋 𓂝 𓈗 𓂡, 𓂋 𓐍 𓏏 𓂝 	கழுவு (kaḻuvu) 	കഴുക് (/kaɻukɨ̆/) 	ತೊಳೆ, ಒಗೆ, ಕುಸುಬು 	 	 	 	
133	to wipe 	తుడుచు (tuḍucu) 	<> Tuch?		తుడుచు (tuḍucu) 	𓇋 𓎛 𓌤, 𓂝 𓎛 𓌤, 2. 𓋴 𓎝 𓎡 𓂝 	துடை (thudai) 	തുടയ്ക്ക് (/t̪uʈajkkɨ̆/), തൂക്ക് (/t̪uːkkɨ̆/) 	ಒರೆಸು 	 	 	 	
134	to pull 		இழு (izhu)  zieh, lag	~+	లాగు (lāgu) 	𓇋 𓏏 𓎛 𓀜, 𓇋 𓏏 𓎛 𓍕, 𓆑 𓂧 𓏴 𓂡, 𓆌 2. 𓄞 𓂧 𓀜 3. 𓊪 𓈖 𓋴 𓏴 𓂡 4. 𓋴 𓍊 𓐍 5. 𓋴 𓏠 𓈖 𓐍 𓍊 𓏛 	இழு (izhu) 	വലിക്ക് (/ʋalikkɨ̆/) 	ಎಳಿ 	 	 	 	
135	to push 	தள்ளு (thallu)			నెట్టు (neṭṭu), తోయు (tōyu) 	𓄿 𓅱 𓅯, 𓅱 𓇋 𓆛 𓈖 𓂢 𓂡  	தள்ளு (thallu) 	തള്ള് (/t̪aɭɭɨ̆/), തെള്ള് (/t̪eɭɭɨ̆/) 	ನೂಕು 	 	 	 	
136	to throw 				విసురు (visuru) 	𓌙,𓌙 𓅯,𓄡 𓀒, 𓀒 𓏏, 𓋴 𓐍 𓀒, 𓈎 𓌚 𓏜, 𓈎 𓌳 𓄿 𓌙 𓅯 𓏜, 𓂝 𓅓 𓂝 𓄿 𓌚, 𓂝 𓅓 𓄿 𓏏 𓏐, 3. 𓋴 𓄝 𓏏 𓀜 	வீசு (visu) 	എറിയ് (/erijɨ̆/) 	ಎಸಿ 	 	 	 	 (biT-)
137	to tie 		Cattie ++	++	కట్టు (kaṭṭu) 	𓈖 𓃀 𓍢 𓂝, 𓎛 𓃀 𓅱 𓃒 2. 𓍿 𓊃 𓋭, 𓋭 𓊃 𓏲 𓂡, 𓎛 𓎸 𓈖 𓊃 𓎡 𓍢 𓂡 3. 𓈎 𓄿 𓋴 𓍢 𓂡 	கட்டு (kaṭṭu) 	കെട്ട് (/keʈʈɨ̆/) 	ಕಟ್ಟು (kaṭṭu) 	 	 	 	
138	to sew 		<> Kutte		కుట్టు (kuṭṭu) 	"ⲱⲧⲉϩ ⲑⲣⲁⲡⲥ ↔ ⲑⲱⲣⲡ , ⲑⲉⲣⲡ 	 	"	தை (tai) 	തൈക്ക് (/t̪aɪkkɨ̆/), തയിക്ക് (/t̪ajikkɨ̆/), തുന്ന് (/t̪unnɨ̆/) 	ಹೊಲಿ 	 	 	 	
139	to count 		le’kincu	~?	లెక్కించు (lekkincu) 	𓍿 𓈖 𓌙 𓅯 𓏌 𓅱 𓏜, 2. 𓎛 𓋴 𓃀 𓐎 𓏛, 𓐎 𓏛 3. 𓇋 𓊪 𓏛 	எண் (eṇ) 	എണ്ണ് (/eɳɳɨ̆/) 	ಎಣಿಸು 	 	 	 	
140	to say 	சொல் (sol) చెప్పు (ceppu)	Say / chat / sappel	x	చెప్పు (ceppu) 	𓆓 𓂧 	சொல் (sol) 	പറയ്‌ (/parajɨ̆/), ചൊല്ല് (/t͡ʃollɨ̆/) മൊഴിക്ക് (/moɻikkɨ̆/) 	ಹೇಳು 	 	 	 	
141	to sing 	പാട് (/paːʈɨ̆/) 	bird?	!!!? <<	పాడు (pāḍu) 	𓎛 𓋴, 𓎛 𓎿 𓊃 𓏮 𓀁 	பாடு (pādu) 	പാട് (/paːʈɨ̆/) 	ಹಾಡು 	 	 	 	
142	to play 				ఆడు (āḍu) 	𓎛 𓃀 𓂝 𓌙 𓌙 𓏜, 𓎛 𓂝 𓃀 𓂡 2. 𓆼 𓄿 𓂝 𓂡 3.  	விளையாடு (vilaiyādu) 	കളി (/kaɭi/), കളിക്ക് (/kaɭikkɨ̆/), ആട് (/aːʈɨ̆/) 	ಆಡು 	 	 	 	
143	to float 			<	తేలు (tēlu) 		மித (mitha) 	പൊങ്ങ് (/poŋŋɨ̆/), പൊന്ത് (/pon̪t̪ɨ̆/) 	ತೇಲು 	 	 	 	
144	to flow 	పారు (pāru)	Flow < para:around ?	<~	పారు (pāru) 	𓋴 𓍬 𓍿 𓄿 𓂻, 2. 𓃀 𓋴 𓂻, 𓄿 𓊃 𓍬 𓂻, 𓄿 𓋴 𓍬 𓂻 3. 𓎡 𓆑 𓆑 𓂐 4. 𓐍 𓂧 𓊛	ஒழுகு (ozhugu) 	ഒഴുക് (/oɻukɨ̆/), ഒലിക്ക് (/olikkɨ̆/) 	ಹರಿ 	 	 	 	
145	to freeze 				గడ్డకట్టు (gaḍḍakaṭṭu) 		உறை (uRai) 	ഉറയ്ക്ക് (/urajkkɨ̆/), കട്ടയാക് (/kaʈʈajaːkɨ̆/) 	ಹೆಪ್ಪುಗಟ್ಟು 	 	 	 	
146	to swell 				వాచు (vācu) 	𓈙 𓆑 𓐎 	வீங்கு (veengu) 	വീർക്ക് (/ʋiːɾkkɨ̆/) 	ಊದು 	 	 	 	
147	sun 	sūryu ñāyi’ṟu	Sarah	++ ..?	సూర్యుడు (sūryuḍu), పొద్దు (poddu) 	𓊃 𓅱 𓇳, 𓆄 𓅱 𓇳, 𓂋 𓂝 𓇳 𓏤, 𓂋 𓂝 𓏏 𓇳 𓁐, 2. 𓇋 𓏏 𓈖 𓇳	ஞாயிறு (ñāyiṟu) 	ഞായർ (/ɲaːjaɾ/) 	ಹೊತ್ತು 	 	 	 	 (de)
148	moon 		camdra (Hindi)	++ 	చంద్రుడు (caMdruḍu), చందమామ (caMdamāma), నెలవేల్పు (nelavēlpu) 	𓇋 𓂝 𓎛, 𓇋 𓎛 𓅆, 𓀭	நிலா (nilā), (thingal) 	തിങ്കൾ (/t̪iŋkaɭ/), നിലാവ് (/n̪ilaːʋɨ̆/) 	ತಿಂಗಳು 	 	 	 	
149	star 		akstra@nakht!!	+ >>	నక్షత్రం (nakṣatraM), తార (tāra), చుక్క (cukka) 	𓇼 𓏤, 𓋴 𓃀 𓄿 𓇼 𓇳, 2. 𓎼 𓈖 𓄡 𓏏 𓇼	விண்மீன் (viṇmīṉ), (natchatram) 	താരം (/t̪aːɾam/) 	ಅರಿಲು, ಚುಕ್ಕೆ 	 	 	 	
150	water 		νερό,neró,naur, nil!!	+++!	నీరు (nīru) 	𓈗, 𓎛 𓃀 𓃀 𓈅 𓈗, 𓎛 𓃀 𓃀 𓏏 𓈗  2. 𓍇 𓏌 𓇋 𓇋 𓈘,  𓈖 𓏏 𓏯 𓈗  3. 𓈗, 𓈗 𓇋 𓇋 𓈗	நீர் (nīr) 	വെള്ളം (/ʋeɭɭam/), നീർ (/n̪iːɾ/) 	ನೀರು 	 	 	 	 (dîr)
151	to rain 	பொழி (pozhi)	kurain.yu 雨 +  weather<water	~+!	కురియు (kuriyu), వర్షించు (varṣiMcu) 	𓇋 𓄿 𓂧 𓏏 𓏯 𓇲, 𓇋 𓂧 𓏏 𓇲, 𓇶, 𓈗, 𓎛 𓀜 𓏷 𓀜 𓈗, 𓎛 𓀝 𓇋 𓇋 𓏏 𓈗, 	பொழி (pozhi), (mazhai) 	പെയ്യുക (/pejjuka/), പൊഴി (/poɻi/) 	ಮಳೆಸುರಿ 	 	 	 	
152	river 	പുഴ (/puɻa/), ആറ് (/aːrɨ̆/)	nauturu, aria, pour, ariva, rod	~+!	నది (nadi) 	𓇋 𓏏 𓂋 𓅱 𓈙 𓏥, 𓇋 𓏏 𓂋 𓃭 𓈘 𓈅 𓏤, 𓇋 𓏏 𓂋 𓈘 𓈗 …	ஆறு (āṟu) 	പുഴ (/puɻa/), ആറ് (/aːrɨ̆/) 	ಹೊಳೆ 	 	 	 	
153	lake 		Sea / thalassea	++ <	సరస్సు (sarassu) 	𓈙 𓈇 𓏤, 𓈘 𓈅 𓏤, 𓄞 𓂧 𓈘 𓈅 𓏤, 𓎛 𓆰 𓈖 𓏏 𓏯 𓈘 𓈇	எரி (eri) 	കായൽ (/kaːjal/) 	ಕೆರೆ 	 	 	 	 (d.and)
154	sea (as in ocean) 		Sea.Ma’ra	+>>	సముద్రం (samudraM) కడలి (kaḍali) 	𓈙, 𓈙 𓈇 𓏤  2. 𓇅 𓆓 𓅨 𓈗 𓈘, 𓇆 𓅨 𓂋 𓇋𓈗 𓈘 𓈅 𓏤, 𓇋𓇋𓏲 𓅓 𓂝 𓈗 𓈘 𓈇	கடல் (kadal) 	കടൽ (/kaʈal/) 	ಕಡಲು 	 	 	 	
155	salt 		[s]up’pur	! 	ఉప్పు (uppu) 	𓎛 𓌳 𓄿 𓏏𓍖 𓈒 𓏥,  𓎛 𓌴 𓏏𓈒 𓏥	உப்பு (uppu) 	ഉപ്പ് (/uppɨ̆/) 	ಉಪ್ಪು (uppu) 	 	 	 	 (be)
156	stone 	రాయి (rāyi) கல் (kal)	rock! ġebla  kar,kő...@Uralic	++ <>	రాయి (rāyi) 	𓊌  2. 𓇋 𓈖 𓂋 𓊌 3. 𓃀 𓇋 𓏏 𓊌 	கல் (kal) 	കല്ല് (/kallɨ̆/), കൽ (/kal/) 	ಕಲ್ಲು 	 	 	 	 (xal)
157	sand 			~?	ఇసుక (isuka) 	𓈙 𓂝 𓏮 𓈒 𓏥, 𓈙 𓂝 𓈒 𓏥	மணல் (manal) 	മണൽ (/maɳal/), പൂഴി (/puːɻi/) 	ಮರಳು, ಉಸುಕು 	 	 	 	
158	dust 	புழுதி (puzhudhi)	Pust! dumnst@Turk! 	++!	దుమ్ము (dummu) 	𓐍 𓅓 𓅱 𓊡 𓏪	புழுதி (puzhudhi), தூசி (thoosi) 	പൊടി (/poʈi/), കാരം (/kaːɾam/) 	ದುಂಬು 	 	 	 	
159	earth (as in soil) 	మట్టి (maṭṭi) мода earth!	Mud <> Mutter Nature	+++!	మన్ను (mannu), మట్టి (maṭṭi), నేల (nēla) 	𓎛 𓄿 𓏏 𓈅 𓏥, 𓄿 𓎛 𓏏 𓈇, 𓄿 𓎡 𓂋 𓀭 𓏪, 𓄿 𓎡 𓂋 𓆙, 𓅱𓂝 𓎛  2. 𓇾 𓈇 𓏤  3. 𓅭𓏏𓅱𓈅 𓏥 , 𓅭𓏏𓏮𓊌 𓊃 𓅭 𓄿 𓏏𓅱𓈇 𓏥  4. 𓎤 𓃀 𓃀 𓈅 𓏥	மண் (maṇ=sand) 	മണ്ണ് (/maɳɳɨ̆/), മണ്‍ (/maɳ/) നിലം (/n̪ilam/) 	ನೆಲ 	 	 	 	
160	cloud 		<> abbu=water	+?	మబ్బు (mabbu) 	𓈎 𓂋 𓇋 𓇲, 𓈎 𓂋 𓇋 𓃫 𓀜, 𓈎 𓂋 𓂋 𓊡, 𓈎 𓂋 𓊡   2. 𓍲 𓈖 𓂝 𓍁  ϭⲏⲡⲉ ?	மேகம் (mēgam) 	മേഘം (megham) 	ಮೋಡ 	 	 	 	
161	fog 	పొగమంచు (poga)	phoga	+++	పొగమంచు (pogamancu) 		பனி (pani) 	മഞ്ഞ്‌ (/maɲɲɨ̆/) പനി- (/pani-/) 	ಕಪ್ಪೆ 	 	 	 	
162	SKY		Nir.vanam!!! Nin.Gün svnne	+?	నింగి (ningi), ఆకాశం(ākāśaM] 	𓇯, 𓊪 𓏏 𓇯, 𓁷 𓏏 𓇯, 𓄿 𓂋 𓏏 𓇯, 𓄿 𓊃 𓂋 𓏏 𓇯  2. 𓈎 𓃀 𓎛 𓅂 , 𓈎 𓃀 𓎛 𓅱𓏁 𓅭 𓏥 𓈉 3. 𓏌 𓏌 𓏏 𓏌 𓇯 𓁐 	வானம் (vaanam) 	വാനം (/ʋaːnam/), മാനം (/maːnam/), വിണ്ണ് (/ʋiɳɳɨ̆/) 	ಮುಗಿಲು 	 	 	 	
163	wind (as in breeze) 	గాలి (gāli)	gale++ காற்று (kāṟṟu) quru@lat	+++ <<!	గాలి (gāli) 	𓊡, 𓅱 𓏏 𓊡, 𓊡 𓅱   2.  𓋴 𓅱 𓎛 𓊡, 𓆓 𓂝 𓊡  𓋴 𓏲 𓎘 𓃀 𓄲 𓏛  3.  𓈖 𓆑 𓏏 𓊡 𓏲	காற்று (kāṟṟu) 	കാറ്റ് (/kaːrrɨ̆/) 	ಗಾಳಿ 	 	 	 	 (ta'oo)
164	snow 		@manchu	+?	మంచు (mancu) 		பனி (pani) 	മഞ്ഞ്‌ (/maɲɲɨ̆/) (from mist/fog) പനി- (/pani-/) 	ಮಂಜು 	 	 	 	
