 № 	English 	Best match	Aryan		Telugu 	Egyptian many variants, often sign value implicit, better see Egyptian.all.tsv!	Tamil 	Malayalam 	Kannada 	Tulu 	Gondi 	Konda-Dora 	Brahui
1	I 	నేను (/neːnu/)	an’e / nous	~++	నేను (/neːnu/) 	"(𓈖𓏏) 𓅱 𓇋 𓀀,  𓇋, 	𓍢 𓇋 , 𓏌𓎡𓍢 "	நான் (/nɑːɳ/) 	ഞാൻ (/ɲaːn/), അടിയൻ (/aʈijan/) (servile; archaic; from foot+I) 	ನಾನು (/nɑːnu/) 	 	 	 	ای (/iː/)
2	you (singular) 	నీవు (/niːvu/)	an’ vous  / 你 nǐ 	~++	నువ్వు (/nuvːu/), నీవు (/niːvu/) 	(𓈖𓏏) 𓎡, 𓏏𓍢, 𓏏𓅱, 𓏏𓈖, 𓈖𓏏 𓏏, 𓈖𓏏 𓍿𓈖𓏥, 𓍿𓈖𓏮, 𓏏𓅱𓎡, 𓏏𓅱𓍿𓈖𓏥	நீ (/niː/) 	നീ (/n̪iː/), താൻ (/t̪aːn/) (polite, familiar; from self), താങ്കൾ (/t̪aːŋkaɭ/) (polite, formal; from self+plural), അങ്ങ് (/aŋŋɨ̆/) (honorific; archaic; from there) നമ്മൾ (/n̪ammaɭ/) (honorific; from inclusive we) 	ನೀನು (/niːnu/) 	 	 	 	نی (/niː/)
3	he 	అతడు (/at̪aɽu/) వాడు (/vɑːɽu/) 	ante’ er/lui 𓇓𓅱𓏏   hver ander der	~+++	అతడు (/at̪aɽu/), అతను (/at̪anu/) వాడు (/vɑːɽu/) వారు (/vɑːru/) 	(𓈖𓏏) 𓇓𓅱, 𓇓𓅱𓏏, 𓆑, 𓊪𓈖	அவன் (avaṉ) 	അവൻ (/aʋan/) (distal), ഇവൻ (/iʋan/) (proximal), അയാൾ (/ajaːɭ/) (distal), ഇയാൾ (/ijaːɭ/) (proximal), അങ്ങേര് (/aŋŋeːɾɨ̆/) (distal; colloquial), ഇങ്ങേര് (/iŋŋeːɾɨ̆/) (proximal; colloquial) 	ಅವನು (avanu) 	 	 	 	او (ō)
4	we 	ನಾವು (nāvu)	Nove nous mir man! 	~+++	మేము (/meːmu/) (exclusive) మనము (/manamu/) (inclusive) நாம் (nām) நாங்கள் (nāṅkaḷ) 	(𓈖𓏏) 𓈖𓏥 ನಾವು nāvu , 𓇋𓏌𓈖𓏥, 𓇋𓀁𓈖𓈖𓏥 మనము manamu	നമ്മൾ (/n̪ammaɭ/) (inclusive), ഞങ്ങൾ (/ɲaŋŋaɭ/) (exclusive), നാം (/n̪aːm/) 	ನಾವು (nāvu) 	 	 	 	نن (nan)	
5	you (plural) 	తమరు (/tamaru/)	𓏏𓈖𓏥 TaMaru Du→mir ninkal 𓍿𓈖𓏤𓏤𓏤	~++!	మీరు (/miːru/) (plural/honorific) తమరు (/tamaru/) (plural/honorific) நீங்கள் (nīṅkaḷ) 	(𓈖𓏏) 𓏏𓈖𓏥, 𓈖𓏏 𓏏𓈖𓏥, 𓍿𓈖𓏤𓏤𓏤	നിങ്ങൾ (/n̪iŋŋaɭ/) 	ನೀವು (neevu) 	 	 	 	نُم (num)	
6	they	അവർ (/aʋar/)	𓅱𓏥 Eux ^^ er	ok?	അവർ (/aʋar/) (distal), ഇവർ (/iʋar/) (proximal), അവന്മാർ (/aʋanmaːr/) (distal; masc.), ഇവന്മാർ (/iʋanmaːr/) (proximal; masc.), അവളുമ്മാർ (/aʋaɭummaːr/) (distal; fem.), ഇവളുമ്മാർ (/iʋaɭummaːr/) (proximal; fem.), അവറ്റകൾ (/aʋarrakaɭ/) (distal), ഇവറ്റകൾ (/iʋarrakaɭ/) (proximal) 	(𓈖𓏏) 𓊃𓈖, 𓋴𓈖𓏥, 𓈖𓏥, 𓈖𓏮, 𓅱𓏥, 𓋴𓏪, 𓋴𓏏𓏥	ಅವರು (avaru) 	 	 	 			
7	this 	ఇది (/idi/)	'die[s] itt@turk	~+	ఇది (/idi/) 	𓏏𓄿, 𓏏𓅱, 𓏏𓅱𓇋𓇋, 𓏏𓈖, 𓍿𓈖, 𓅮, 𓅮𓄿, 𓇑𓇑, 𓇑𓇑𓈖, 𓈖𓄿, 𓉐, 𓊪𓅮𓄿, 𓊪𓅱, 𓊪𓅱𓇋𓇋, 𓊪𓈖	இது (itu) 	ഈ (/iː/), ഇ- (/i-/), ഇത് (/it̪ɨ̆/) (thing/fact) 	ಇದು (idu) 	 	 	 	
8	that 	అది (/adi/)	'dai[s] ott@turk that	~+	అది (/adi/) 	𓏏𓆑𓄿,𓏏𓆑,𓏏𓅱,𓏏𓅱𓇋𓇋,𓈖𓆑,𓊪𓅱𓇋𓇋,𓊪𓆑𓏮,𓊪𓆑𓄿𓈐,	அது (/at̪ɨ̆/) 	ആ (/aː/), അ- (/a-/), അത് (/at̪ɨ̆/) (thing/fact) 	ಅದು (adu) 	 	 	 	
9	here 	ఇక్కడ (/ikːaɽa/) ఇచ్చట (/icːaʈa/)	ici.da <> where ahere, enci 𓈖𓏏 இங்கே iṅkē	~+	ఇక్కడ (/ikːaɽa/) ఇచ్చట (/icːaʈa/) ఈడ (/iːɽa/) இங்கே (iṅkē) 	𓈖𓄿, 𓂧 𓏮 𓈐, 𓉻 𓂝 𓈐, 𓉻 𓂝 𓄿 𓇋𓇋 𓈐	ഇവിടെ (/iʋiʈe/), ഇങ്ങ് (/iŋŋɨ̆/) 	ಇಲ್ಲಿ (illi), ಇದರಲ್ಲಿ (idaralli) 	 	 	 		
10	there 	అక్కడ (/akːaɽa/) 	ahere, ante, [th]ere,    enci 𓈖𓏏 அங்கே aṅkē	~+	అక్కడ (/akːaɽa/) అచ్చట (/acːaʈa/) ఆడ (/ɑːɽa/) அங்கே (aṅkē) 	𓂧 𓏮 𓈐, 𓉻 𓂝 𓄿 𓇋𓇋 𓈐, 𓇋𓅓,	അവിടെ (/aʋiʈe/), അങ്ങ് (/aŋŋɨ̆/) 	ಅಲ್ಲಿ (alli) 	 	 	 		
11	who 	ఎవరు evaru யார் (yār)	'wer!	~++	ఎవరు (/evaru/) < 𓊪𓅱 < 𓊪𓏏𓂋	𓊪𓅱, 𓊪𓏏𓂋, 𓅓 𓂟, 𓅓 𓂝, 𓈖𓅓𓂝,𓊄 𓇋𓇋, 𓋴, 𓏶	யார் (yār) 	ആര് (/aːɾɨ̆ /), എവൻ (/eʋan/) (singular masculine), എവൾ (/eʋaɭ/) (singular feminine), എവർ (/eʋar/) (plural) 	ಯಾರು (yāru) 	 	 	 	
12	what 	ఏమిటి (/eːmiʈi/) ఏంటి (/eːɳʈi/) 	𓅓 𓂟, 𓅓 𓂝 'mwit, ‘na	~++	ఏమిటి (/eːmiʈi/) ఏంటి (/eːɳʈi/) 	𓊪𓅱, 𓊪𓏏𓂋, 𓅓 𓂟, 𓅓 𓂝, 𓈖𓅓𓂝,𓊄 𓇋𓇋, 𓐍 𓏮, 𓋴, 𓏶, 𓏏𓊪𓏮 𓆵 𓀁	என்ன (eṉṉa) 	എന്ത് (/en̪t̪ɨ̆/), എന്നത് (/ennat̪ɨ̆/), എന്ന- (/enna-/) 	ಏನು (Enu) 	 	 	 	
13	where 	ఎక్కడ (/ekːaɽa/) 	a’kwhere ++ <> here	~++	ఎక్కడ (/ekːaɽa/) ఎచ్చట (/ecːaʈa/) ఏడ (/iːɽa/) எங்கே (eṅkē) 	𓏏𓈖𓏮𓌙𓅯 𓈐, 𓏏𓈖𓏌𓅱𓌙𓅯	എവിടെ (/eʋiʈe/), എങ്ങ് (/eŋŋɨ̆/) 	ಎಲ್ಲಿ (elli) 	 	 	 		
14	when 	ఎప్పుడు (/epːuɽu/) 	ap’houra ! ++	~++	ఎప్పుడు (/epːuɽu/) 	𓐍𓆑𓏏, 𓐍𓏏𓆑, 𓐍𓆑, 𓅯𓅯, 𓅓	எப்பொழுது (eppoḻutu) 	എപ്പോൾ (/eppoːɭ/), എപ്പം (/eppam/) എന്ന് (/en̪n̪ɨ̆/) (which day) 	ಯಾವಾಗ (yāvāga) 	 	 	 	
15	how 	எப்படி (eppaṭi)  ಹೇಗೆ (hEge) 	a’what? Howgue?	~?	ఎలా (/elɑː/), ఎట్లా (/eʈlɑː/) 	𓅱,𓅱𓏮,𓏇𓇋𓅓𓂝	எப்படி (eppaṭi) 	എങ്ങനെ (/eŋŋane/) 	ಹೇಗೆ (hEge) 	 	 	 	
16	NOT	కాదు (kādu) లేదు(lēdu)	Cut kein let! Lass! la! ¬des	~+	కాదు (kādu) (negation), లేదు(lēdu) (absence) 	𓂜, 𓂜𓈖,𓂜𓏏,𓇋𓂋𓆑,𓄤𓊪𓅱, 𓅱, 𓅓, 𓅓𓂝, 𓅓𓂟, 𓅱𓂜, 𓂜𓇋𓇋	இல்லை (illai) 	അല്ല (/alla/) (negation), ഇല്ല (/illa/) (absence) 	ಅಲ್ಲ (alla) 	 	 	 	
17	all 	ಎಲ್ಲ (ella) 	ella!! adam! Einige	!++	అందరు (aMdaru) (humans), అన్నీ (annī) (countable nouns), మొత్తము(mottamu) (uncountable nouns) 	𓎟, 𓂋 𓋴 𓋴, 𓅓 𓃀 𓅱𓌡 𓏤, 𓇾 𓅓 𓅱𓀀 𓏥 𓁐, 𓇾 𓍃 𓅓 𓏥, 𓇿 𓇿 𓈅 𓈅 𓏏𓍃 𓀀 𓏥 𓁐, 𓏏 𓏏 𓏝 	எல்லாம் (ellām) 	എല്ലാം (/ellaːm/), എല്ലാ (/ellaː/), മുഴുവൻ (/muɻuʋan/), മൊത്തം (/mot̪t̪am/) 	ಎಲ್ಲ (ella) 	 	 	 	
18	many 	చాలా (cālā)  பல (pala) 	c’alle! Poly பல (pala) viele PQ	~++	చాలా (cālā) 	𓅨 𓂋, 𓁨 𓈖, 𓂝 𓈙 𓄿 𓆈, 𓆈 𓄿 𓏏𓀀 𓏥, 𓉻 𓏏𓏯 𓈙 𓏥	பல (pala) 	ഒത്തിരി (/ot̪t̪iɾi/) (a lot), ഏറെ (/eːre/), പല (/pala/) (various) 	ಹಲ (bahaLa) 	 	 	 	
19	some 	కొందరు (koMdaru) (humans)	Kaum khumen… < calle	+<	కొందరు (koMdaru) (humans), కొన్ని (konni) (countable nouns), కొంత (koMta) (uncountable nouns) 	𓈖 𓉔 𓅪 𓈒 𓏥, 𓈖 𓎡 𓏏 𓏴 𓏛	சில (cila) 	ചില (/t͡ʃila/) 	ಕೆಲ (kela) 	 	 	 	
20	few 	కొన్ని (/konːi/)  கொஞ்சம் (koñcam) 	quanta ~kaum.quam>kein ^^	!+	కొన్ని (/konːi/) 	𓂝 𓈖 𓂧 𓏏 𓅪	கொஞ்சம் (koñcam) 	കുറച്ച് (/kurat͡ʃt͡ʃɨ̆/), ഇത്തിരി (/it̪t̪iɾi/) 	ಕೊಂಚ (kelavu) 	 	 	 	 (macciT)
21	other 	ఇతర itara	othera        mbere~andere	++	వేరే (vērē) ఇతర (itara) 	𓎡 𓏏, 𓎡 𓏮	மற்ற (maṟṟa) 	മറ്റ് (/marrɨ̆/), ഇതര (/it̪aɾa/) 	ಬೇರೆ (bērē) 	 	 	 	
22	one 	"ఒకటి (okaṭi) ஒன்று (oṉṟu) 	ഒന്ന് (/on̪n̪ɨ̆/)"	Ek第 ++ einer erst	++	ఒకటి (okaṭi) 	𓏤, 𓌡 , 𓏏 𓅱	ஒன்று (oṉṟu) 	ഒന്ന് (/on̪n̪ɨ̆/), ഒരു (/oɾu/) 	ಒಂದು (ondu) 	 	 	 	 (asiT)
23	two 	ಎರಡು (eraDu)	èr 二 …Du ! 第	-+	రెండు (reMḍu) 	𓌢 𓏌 𓏮, 𓌢 𓈖 𓏌 𓏲 𓏮	இரண்டு (iraṇṭu) 	രണ്ട് (/ɾaɳʈɨ̆/), ഇരു- (/iɾu-/) 	ಎರಡು (eraDu) 	 	 	 	 (iraT)
24	three 	மூன்று (mūṉṟu)	man! 第 more	+-	మూడు (mūḍu) 	𓐍 𓂸 𓏏	மூன்று (mūṉṟu) 	മൂന്ന് (/muːn̪n̪ɨ̆/), മു- (/mu-/) 	ಮೂರು (mooru) 	 	 	 	 (musiT)
25	four 	നാൽ- (/n̪aːl-/)	nailu!  第	++™	నాలుగు (nālugu) 	𓆑 𓂧 𓅱 𓏤 𓏤 𓏤 𓏤, 𓇋 𓆑 𓂧 𓏏 𓏥, 𓆑 𓂧 𓏤 𓏏 𓏤 𓏤 𓏤	நான்கு (nāṉku) 	നാല് (/n̪aːlɨ̆/), നാൽ- (/n̪aːl-/) 	ನಾಲ್ಕು (nālku) 	 	 	 	
26	five 	ஐந்து (aintu) 	(p)aintu! 𓏥 𓏮 𓏏𓅱𓂻 第	++	ఐదు (aidu) 	𓏥 𓏮 𓏏𓅱𓂻	ஐந்து (aintu) 	അഞ്ച് (/aɲt͡ʃɨ̆/), അൻ- (/an-/) 	ಐದು (aidu) 	 	 	 	
27	big 	పెద్ద (pedda) பெரிய (periya) 	<> pod super? Da^ better		పెద్ద (pedda) 	𓅨 𓂋 𓈉	பெரிய (periya) 	വലിയ (/ʋalija/), പെരും- (/peɾum-/) 	ದೊಡ್ಡ (doDDa) 	 	 	 	
28	long 	పొడవైన (poḍavaina) 	<> pod  𓈖𓄣 nile.manner		పొడవైన (poḍavaina) 	𓄫 𓅱, 𓍯 𓄿 𓈐, 𓈐, 𓇥 𓂋 𓂝 𓏤	நீளமான (nīḷamāṉa) 	നീണ്ട (/n̪iːɳʈa/) 	ನಿಡು (niḍu) 	 	 	 	 (murghun)
29	wide 	వెడల్పైన (veḍalpaina)	veda… alipine	++	వెడల్పైన (veḍalpaina) 	𓋴 𓐍 𓎺, 𓅱 𓋴 𓐍 𓎸 𓏛,	அகலமான (akalamāṉa) 	വീതിയുള്ള (/ʋiːt̪ijuɭɭa/), വണ്ണമുള്ള (/ʋaɳɳamuɭɭa/) 	ಅಗಲ (agala) 	 	 	 	
30	thick 	t̪aʈit͡ʃt͡ʃa ;)	thick… 	++	మందమైన (maMdamaina), చిక్కని (chikkani) 	𓃀 𓅡 𓄿 𓎼 𓈗, 𓅱 𓂸 𓏏 𓏛	தடித்த (thaditha) 	കട്ടിയുള്ള (/kaʈʈijuɭɭa/), തടിച്ച (/t̪aʈit͡ʃt͡ʃa/) 	ದಪ್ಪ (dappa) 	 	 	 	
31	heavy 	బరువైన (baruvaina) 	bary	++	బరువైన (baruvaina) 	𓆓𓈖𓋴𓍘𓏜, 𓂧𓈖𓋴𓍖 𓊌, 𓅱𓂧𓈖𓍖 𓈒 𓏥	கணம் (kaNam) 	കനത്ത (/kanat̪t̪a/), കനമുള്ള (/kanamuɭɭa/) 	ತೂಕ (tūka) 	 	 	 	
32	small 	cunz, kot͡ʃt͡ʃ ;) ++	kurz	++	చిన్న (cinna) 	𓎡 𓏏 𓏏 𓅪, 𓈖𓆓 𓋴 𓅪, 𓈖 𓐍 𓅪, 𓀔 𓏥 𓈖𓂣	சின்ன (ciṉṉa) 	ചെറിയ (/t͡ʃerija/), കൊച്ചു (/kot͡ʃt͡ʃu/), കുഞ്ഞു (/kuɲɲu/) 	ಸಣ್ಣ (saNNa), ಚಿಕ್ಕ (chikka) 	 	 	 	 (cunak)
33	short 	കുറു (/kuru/), കുള്ളൻ (/kuɭɭan/)	kurz, klein, petit	+++	పొట్టి (poṭṭi) 	𓅪, 𓈙 𓂋 𓂋 𓅪, 𓎛 𓂝 𓅪, 𓎛𓅱𓂝𓅪	குட்டை (kuttai) 	കുറു (/kuru/), കുള്ളൻ (/kuɭɭan/) 	ಗಿಡ್ಡ (giDDa), ಕುಳ್ಳ (kuLLa) 	 	 	 	
34	narrow 	సన్నని (sannani)	thin/ schmal	:	ఇరుకైన (irukaina), సన్నని (sannani) 	𓎼 𓄿 𓎣 𓅪, 𓎼 𓄿 𓐎 𓅪, 𓎛 𓆰 𓈖 𓋴 𓅪	குறுகிய (kurugiya) 	ഇടുങ്ങിയ (/iʈuŋŋija/) 	ಸಪುರ (sapura) 	 	 	 	
35	thin 	సన్నని (sannani)	thin	++	సన్నని (sannani), పలుచని (palucani) 	? <> 𓊪 𓈎 𓏗, 𓆁 𓈎 𓏗, 𓊪 𓅮 𓈎 𓏗, 𓅮 𓄿 𓈎 𓏏 𓂂	ஒல்லி (olli) 	നേർത്ത (/n̪eːɾt̪t̪a/), മെലിഞ്ഞ (/meliɲɲa/) 	ತೆಳು (teLu) 	 	 	 	 (tanak)
36	woman 	பெண் (peṇ) మహిళ (mahiḷa) 	Femme / matha	+?	ఆడది (āḍadi), స్త్రీ (strī), మహిళ (mahiḷa) 	𓊃 𓏏 𓁐, 𓈟 𓏏 𓁐, 𓊃 𓏏 𓁐 𓈞 𓏏 𓁐, 𓃀 𓂓 𓏏 𓁑	பெண் (peṇ) 	പെണ്ണു് (/peɳɳɨ̆/), പെണ്‍- (/peɳ-/) 	ಹೆಂಗಸು, ಹೆಣ್ಣು (hengasu) 	ಪೊಣ್ಜವು poṇjavu, ಎಮ್ಮಳು emmaḷu 	ఆర్ ār, వెయ్లెు veylo, వోతాఢ్ vōtāṛ 	ఆణ్డు āṇḍu, మాఈ māī 	مائى māī
37	man (adult male) 		mega.vadu! [m]Ahn! Pere:bara@rom	++ <<	మగవాడు (magavāḍu), పురుషుడు (puruṣuḍu) 	𓊃 𓀀, 𓀀 𓀀 𓀀, 𓂋 𓍃 𓀀 𓏥, 𓂋 𓏏 𓀀 𓏥 𓁐, 𓂋 𓍿 𓀀, 𓂋 𓐍 𓏛 𓀀, 𓂋 𓍿 𓏏 𓀀 𓏥, 𓂋 𓐝 𓍿 𓀀 𓁐, 𓆂 𓏏 𓏥, 𓅓 𓏏 𓀐, 𓅷 𓄿 𓇋𓇋𓂺 𓀀, 𓍿𓈖𓇋𓀘, 𓀙, 𓎛 𓃹 𓈖 𓀔, 𓁷 𓂋 𓇯 𓀀, 𓄊 𓂋 𓀀	ஆண் (āṇ) 	ആണ് (/aːɳɨ̆/), ആണ്‍- (/aːɳ-/) 	ಗಂಡಸು, ಆಳು (gaNDasu) 	 	 	 	
38	man (human being) 	மனிதன் (maṉitaṉ)	manys.tan	+++	మనిషి (maniṣi) 	%	மனிதன் (maṉitaṉ) 	ആള് (/aːɭɨ̆/), -ആൾ (/-aːɭ/) 	ಮಂದಿ (maṃdi) 	 	 	 	
39	child (a youth) 	పిల్ల (pilla) (female)	fille, fils < copile @ROM 	+++	పిల్ల (pilla) (female), పిల్లవాడు (pillavāḍu) (male) 	𓄡 𓂋 𓂧 𓀀, 𓐍 𓏤 𓀔, 𓀖 𓏏, 𓐍 𓇋 𓇋 𓀔, 𓐍 𓈖 𓏌 𓅱 𓀔, 𓎛 𓃹 𓈖 𓀔, 𓈖 𓐍 𓈖 𓅱 𓀔,𓄟 𓋴 𓏯, 𓄟 𓅱 𓏏 𓏏 𓀔, 𓋴 𓆓 𓏏, 𓇋 𓈖 𓊪 𓅂	குழந்தை (kuḻantai), பிள்ளை (pillai) 	കുട്ടി (/kuʈʈi/), കുഞ്ഞ് (/kuɲɲɨ̆/), പിള്ള (/piɭɭa/), കിടാവ് (/kiʈaːʋɨ̆/) 	ಮಗು (magu), ಕೂಸು (koosu) 	 	 	 	 (cunaa, maxa)
40	wife 	భార్య (bhārya), ఆలి (āli) 	man.eve  wo.man	+?	పెళ్ళాం (peḷḷāM), భార్య (bhārya), ఆలి (āli) 	𓌢 𓈖 𓏏 𓁐, 𓊃 𓏏 𓁐, 𓊃 𓏏 𓁐 𓈞 𓏏 𓁐, 𓈟 𓏏 𓁐, 2. 𓌸 𓂋 𓏏, 3. 𓎟 𓏏 𓉐 𓏤	மனைவி (maṉaivi) 	കെട്ടിയവൾ (/keʈʈijaʋaɭ/), മണവാട്ടി (/maɳaʋaːʈʈi/) (bride) 	ಹೆಂಡತಿ (heNDati), ಮಡದಿ (maḍadi) 	 	 	 	
41	husband 		^^ man = Macker భర్త bharta@ROM	+?	మొగుడు (moguḍu), భర్త (bharta), పెనిమిటి (penimiṭi) 	𓉔 𓂸, 𓎟 𓀀, 𓌢𓈖𓀀	கணவன் (kaNavan) 	കെട്ടിയവൻ (/keʈʈijaʋan/), മണവാളൻ (/maɳaʋaːɭan/) (bridegroom) 	ಗಂಡ (gaNDa) 	 	 	 	
42	mother 	அம்மா (ammā)	Mama Amme	++	అమ్మ (amma), తల్లి (talli) 	𓅐 𓏏 𓁐, 𓄟 𓋴 𓏏 𓁒, 𓂠 𓏏 𓁐, 𓂸 𓏏 𓁐, 𓅐 𓂋 𓏏 𓁐?	அம்மா (ammā) 	അമ്മ (/amma/), തള്ള (/t̪aɭɭa/) 	ಅಮ್ಮ (amma), ತಾಯಿ (thayi) 	 	 	 	 (ammaa)
43	father 	அப்பா (appā)  	Papa t’andro	++ -?	నాన్న (nānna), తండ్రి (tandri) 	𓇋 𓏏 𓆑 𓀀	அப்பா (appā), தந்தை (thandhai) 	അച്ഛൻ (/at͡ʃt͡ʃʰan/), അപ്പൻ (/appan/), തന്ത (/t̪an̪t̪a/) 	ಅಪ್ಪ (appa) 	 	 	 	
44	animal 		jungle Tierv	?	జంతువు (jaMtuvu) 	𓄛   <> 𓂧𓂋𓄛 	விலங்கு (vilaṅku), மிருகம் (mirugam) 	 	 	 	 	 	
45	fish 	மீன் (mīṉ) 	Min ~ naun   చేప cēpa~fish -	~+	చేప (cēpa) 	𓆑 𓏏 𓏏 𓅱, 𓂋 𓅓 𓆛 𓂻, 𓅱 𓎛 𓂝 𓆟	மீன் (mīṉ) 	മീൻ (/miːn/) 	ಮೀನು (meenu) 	 	 	 	
46	bird 	പറവ (/paraʋa/)   పిట్ట (piṭṭa)  	bird, papagei	+++	పక్షి (pakṣi), పిట్ట (piṭṭa) 	𓄿 𓏤, 𓄿 𓊪 𓂧 𓅬, 𓂧 𓎼 𓇋 𓇋 𓏏 𓀃 𓅭, 𓅭, 𓅿	பறவை (paṟavai) 	കിളി (/kiɭi/), പറവ (/paraʋa/) 	ಹಕ್ಕಿ (hakki) 	 	 	 	
47	dog 	కుక్క (kukka) நாய் (nāy) 	Kuan*2	~++ ?	కుక్క (kukka) 	𓍿 𓊃 𓅓 𓃡, 𓃛 𓅱 𓃡, 𓃛 𓅱 𓏮 𓊗 𓄛	நாய் (nāy) 	പട്ടി (/paʈʈi/), നായ (/n̪aːja/) 	ನಾಯಿ (nāyi) 	 	 	 	
48	louse 	పేను (pēnu) 	ϥⲉⲛⲧ 𓆑 𓈖 𓏏 [[𓆑]] worm (sic)	<?>	పేను (pēnu) 	𓎡 𓏏 𓏏 𓆨	பேன் (pēn) 	പേൻ (/peːn/) 	ಹೇನು (hēnu) 	 	 	 	
49	snake 	పాము (pāmu) 	ϥⲉⲛⲧ 𓆑 𓈖 𓍿 [[𓆙]] snake phy.ma <> wurm?	++?	పాము (pāmu) 	𓆑 𓈖 𓏏 𓆙, 𓆑 𓈖 𓍿 𓆙, 𓅭 𓇾 𓆙, 𓆓 𓂧 𓆑 𓏏 𓆙, 𓋴 𓍋 𓃀 𓏏 𓆙, 𓎛 𓆑 𓄫 𓅱 𓆙, 𓂋 𓂋 𓎡 𓎡 𓆙	பாம்பு (pāmpu), நாகம் (nāgam) 	പാമ്പ് (/paːmpɨ̆/) 	ಹಾವು (hāvu) 	 	 	 	 (dûSva)
50	worm 	പുഴു (/puɻu/), വിര (/ʋiɾa/)	Pwurm puɻu ʋiɾa VER புழு (puzhu) <> pytho?	+++ <	పురుగు (purugu) 	𓆑 𓈖 𓍿 𓆙, 𓆓 𓂧 𓆑 𓏏 𓆙	புழு (puzhu) 	പുഴു (/puɻu/), വിര (/ʋiɾa/) 	ಹುಳ (huLa) 	 	 	 	
51	tree 	చెట్టు (ceṭṭu) மரம் (maram) 	cedar 𒄑  𓎼 𓏏 <  𓍿 𓂋 𓏏 𓆭   2. 木 mùr	++	చెట్టు (ceṭṭu) 	1. 𓍲 𓈖 𓆭, 2. 𓏙 𓈎, 3. 𓂧 𓈎 𓂋 𓂷 𓈒 𓏥, 4. 𓅡 𓈎 𓆭 5. 𓆭 𓅓 𓆭 6. 𓆱 𓏏 𓏤 7. 𓈎 𓃀 𓆭	மரம் (maram) 	മരം (/maɾam/), ചെടി (/t͡ʃeʈi/) (plant) 	ಮರ (mara) 	 	 	 	 (draxt)
52	forest 	காடு (kāṭu)	cedar 𒄑	^^	అడవి (aḍavi) 	𓏠 𓏌 𓏌 𓏌 𓆭 𓆭 𓆭, 𓏠 𓏌 𓏌 𓏌 𓆮	காடு (kāṭu) 	കാട് (/kaːʈɨ̆/) 	ಕಾಡು (kāḍu) 	 	 	 	
53	stick (of wood) 	కట్టె (kaṭṭe) కర్ర (karra)	cedar 𒄑 cut	^^	కర్ర (karra), కట్టె (kaṭṭe) 	𓆱 𓏏 𓏤, 2. 𓂝 𓅓 𓂝 𓄿 𓏏 𓌚	குச்சி (kucci) 	വടി (/ʋaʈi/), കമ്പ് (/kampɨ̆/) (twig), കോൽ (/koːl/) (staff) 	ಕೋಲು, ಕಡ್ಡಿ, ಬಡಿ 	 	 	 	
54	fruit 	പഴം (/paɻam/)  ఫలము (phalamu) 	Phrui Pflaume 👁	+++	పండు (paNḍu), ఫలము (phalamu) 	"𓉐 𓂋 𓏏 𓏯 𓌾 𓏥, 𓉐 𓂋 𓏏 𓂺 𓈓, 𓉐 𓂋 𓏏 𓍁 𓈓, 𓍁 𓂋 𓏏 , 2. 𓂋 𓂋  3. 𓏙 𓈎	4. 𓂧 𓄿 𓃀 𓆳 5. 𓇭 𓈒 𓏥fruit, seed "	பழம் (paḻam) 	പഴം (/paɻam/), കായ്‌ (/kaːjɨ̆/) 	ಹಣ್ಣು 	 	 	 	
55	seed 	കുരു (/kuɾu/), അരി (/aɾi/) 	vita corn 𓂋	~++	విత్తనం (vittanaM) 	𓄝 𓏏 𓇋 𓇋 𓏏 𓂺 𓏥,  𓂸 𓏏 𓏲 𓏏 𓂺 𓏥, 𓅓 𓏏 𓂺 𓅱 𓏏	விதை (vithai) 	വിത്ത് (/ʋit̪t̪ɨ̆/), കുരു (/kuɾu/), അരി (/aɾi/) 	ಬಿತ್ತು (bittu) 	 	 	 	
56	leaf 	இலை (ilai) 	foil~leaf	~+	ఆకు (āku) 	𓇥 𓂋 𓆓 𓄔, 𓂝 𓂋 𓇋 𓇋 𓏏 𓆱, 𓄔 𓏤, 𓋴𓐟 𓄿 𓊪𓏏𓆰	இலை (ilai) 	ഇല (/ila/), ഓല (/oːla/) 	ಎಲೆ (ele) 	 	 	 	
57	root 	వేరు (vēru)[t]  < ಬೇರು (bēru)	bu.root <> 𓍯 𓄿 𓃀 𓆰	~+	వేరు (vēru) 	𓍯 𓄿 𓃀 𓆰, 𓏠𓈖𓇋𓇋𓏏𓆱, 𓆱𓇛, 𓇡 	வேர் (vēr) 	വേര് (/ʋeːɾɨ̆/) 	ಬೇರು (bēru) 	 	 	 	 (bex)
58	bark (of tree) 	బెరడు (beraḍu) 	bark ~ bardge	~++	బెరడు (beraḍu) 		பட்டை (pattai) 	മരത്തൊലി (/maɾat̪t̪oli/), പട്ട (/paʈʈa/) 	ತೊಗಟೆ (togaṭe) 	 	 	 	
59	flower 	పువ్వు (puvvu), పుష్పము (puṣpamu) 	phlower 𓃀 𓆰	~++	పువ్వు (puvvu), పుష్పము (puṣpamu) 	𓆸 ⋍ 𓆹, 𓊃 𓈙 𓈖 𓆸,  𓇇𓆰, 𓇬𓈖𓃀, 𓃹𓈖𓃀𓆰, 𓁷 𓂋 𓂋 𓏏 𓆰, 	பூ (pū), மலர் (malar) 	പൂവ് (/puːʋɨ̆/), പൂ (/puː/) 	ಹೂವು (hūvu) 	 	 	 	
60	grass 	గడ్డి (gaḍḍi) 	gradh ~ grass growth	~++	గడ్డి (gaḍḍi) 	𓁸  𓏥  2.  𓍲 𓈖 𓏌 𓏲 𓁸, 𓍲 𓈖 𓏮 𓁸 𓏥 	புல் (pul) 	പുല്ല് (/pullɨ̆/), പുൽ- (/pul-/), പോച്ച (/poːt͡ʃt͡ʃa/) 	ಹುಲ್ಲು (hullu) 	 	 	 	 (bey)
61	rope 	తాడు (tāḍu) கயிறு (kayiṟu) 	tau! Cord	~+	తాడు (tāḍu), మోకు (mōku) 	𓁷 𓏤 𓍢, 𓂝 𓎛 𓍢, 𓇋 𓎛 𓍢, 𓍱 𓋴 𓍢 2. 𓈖 𓍇 𓏌 𓅱 𓎛 𓍢 	கயிறு (kayiṟu) 	കയറ് (/kajaɾɨ̆/), വള്ളി (/ʋaɭɭi/) (also vine) 	ನೇಣು (nēṇu) 	 	 	 	 (cvit)
62	skin (of a person) 	చర్మము(carmamu) 	Teil/Tol < leDer,  γδέρ κρέαma	~+ <<	తోలు (tōlu), చర్మము(carmamu) 	𓄛, 𓄚 𓈖 𓏏 𓄛, 𓄞 𓂧 𓅱, 2. 𓄟 𓋴 𓂓 𓄛 3. 𓃀 𓅡 𓄇 𓄛  	தோல் (tōl) 	തൊലി (/t̪oli/), തോല് (/t̪oːlɨ̆/) (hide), തോൽ (/t̪oːl/) (hide) 	ತೊಗಲು (togalu) 	 	 	 	
63	meat (as in flesh) 	கறி (kaRi)	Carne κρέα  mamf;)	~++	మాంసం (māMsaM) 	𓄹, 𓇋 𓆑 𓄻 𓏥, 𓇋 𓅱 𓆑 𓄹 𓄹 𓄹, 𓄿 𓈙 𓂋 𓄹, 𓅨 𓂋 𓇋 𓄹	கறி (kaRi) 	ഇറച്ചി (/irat͡ʃt͡ʃi/) 	ಬಾಡು (bāḍu) 	 	 	 	
64	blood 	రక్తము (raktamu) குருதி (kuruthi)	^^ red adamu	~+ <<	రక్తము (raktamu), నెత్తురు (netturu) 	𓂐, 2. 𓂧 𓈙 𓂋 𓂐, 𓂧 𓈙 𓂋 𓅱 𓏯 3. 𓊃 𓈖 𓆑 𓅱 𓂐	குருதி (kuruthi) 	ചോര (/t͡ʃoːɾa/) 	ನೆತ್ತರು (nettaru) 	 	 	 	 (ditar)
65	bone 	బొమికె (bomike)	bome	~++	ఎముక (emuka), బొమికె (bomike), బొక్క (bokka) 	𓌟 𓏤, 𓈎 𓋴 𓌟	எலும்பு (elumpu) 	എല്ല് (/ellɨ̆/) 	ಎಲುಬು (elabu) 	 	 	 	
66	fat (noun) 	కొవ్వు (kovvu)	covfat  కొవ్వు (kovvu) 𓄡 𓊪 𓈖 𓃾 …	~+	కొవ్వు (kovvu) 	𓎙 𓂧 𓏌 𓏥, 𓎙 𓆓 𓊌 𓏥, 𓂝 𓆓 𓎙 𓏌 𓏥, 𓄞 𓂧 𓐏, 𓆓 𓂧 𓂉,  𓆓 𓂧 𓄿 𓄃,  2. 𓈎 𓈖 𓐎  3. 𓄡 𓊪 𓈖 𓃾 …	கொழுப்பு (koluppu) 	കൊഴുപ്പ് (/koɻuppɨ̆/) 	ಕೊಬ್ಬು (kobbu) 	 	 	 	
67	egg 	முட்டை (muṭṭai)	egg/ei@mutheo  yumurta!	~+	గుడ్డు (guḍḍu) 	𓏏 𓏥, 𓋴 𓅱 𓎛 𓏏 𓆇 𓐎	முட்டை (muṭṭai) 	മുട്ട (/muʈʈa/) 	ಮೊಟ್ಟೆ (moṭṭe) 	 	 	 	
68	horn 	ಕೊಂಬು (koṃbu)	khornm jambe  𓂝 𓃀 𓄏 𓏤		కొమ్ము (kommu) 	𓄏 𓏤, 𓎛 𓆰 𓈖𓄏, 𓎛 𓆱 𓈖 𓏌 𓏏 2. 𓂧 𓃀 𓄏,  𓂝 𓃀 𓄏 𓏤	கொம்பு (kompu) 	കൊമ്പ് (/kompɨ̆/) 	ಕೊಂಬು (koṃbu) 	 	 	 	 (margh)
69	tail 	తోక (tōka[l]) வால் ([t]vāl)	𓋴 𓂧 ⲥⲁⲧ cat | toca reverse	~?	తోక (tōka) 	1. 𓄜 2. 𓋴 𓂧 𓄢 3. 𓐍 𓃀 𓋴 𓇋 𓇋 𓏏 𓏥 , 𓐍 𓃀 𓊃 𓏏 𓄢  	வால் (vāl) 	വാല് (/ʋaːlɨ̆/), വാൽ- (/ʋaːl-/) 	ಬಾಲ (bala), ತೋಕೆ (tōke)				
70	feather (rather not down) 	ఈక (īka)  இறகு (iraku) 	ikarus [f]üka=fligh@TURK		ఈక (īka) 	𓆄 𓅱 𓏏 𓁸 2. 𓆅 𓏏 𓏤 𓁸	இறகு (iraku) 	തൂവല് (/t̪uːʋalɨ̆/), തുവൽ- (/t̪uːʋal-/), പൂട (/puːʈa/) 	ಗರಿ 	 	 	 	
71	hair 			--- BODY PARTS ---	వెంట్రుకలు (veMṭrukalu), జుట్టు (juṭṭu) 	 𓎛, 𓁸𓏥, 𓍲 𓈖 𓏌 𓏲 𓁸, 𓍲 𓈖 𓏮 𓁸 𓏥, 𓃀 𓎡 𓎡 𓁸, 𓃀 𓂓 𓁸 	முடி (muṭi) 	മുടി (/muʈi/) (of head), പൂട (/puːʈa/) (of animal; not of head) 	ಕೂದಲು (kūdalu) 	 	 	 	
72	head 	తల (tala) 	Tall Teil tell?	<<	తల (tala) 	𓁶 𓊪, 𓁶 𓏤, 2. 𓁷 𓂋 𓇯 𓀀	தலை (talai) 	തല (/t̪ala/), മുടി (/muʈi/) (from head hair) 	ತಲೆ 	 	 	 	
73	ear 	చెవి (cevi)	𓇥 𓂋 𓆓 𓄔  voce	/	చెవి (cevi) 	1.𓄔 2.𓄕 3.𓂈 𓏤         1. 𓄟 𓋴 𓇥 𓂋 𓄔 2. 𓇋 𓂧 𓄔 3. 𓇥 𓂋 𓆓 𓄔	காது (kātu) 	ചെവി (/t͡ʃeʋi/), കാത് (/kaːt̪ɨ̆/) 	ಕಿವಿ 	 	 	 	 (xaf)
74	eye 	கண் (kaṇ) 	AuGen / keyen	<<	కన్ను (kannu), నేత్రం (netram) 	1a. 𓁹 1b. 𓂝 𓈖 𓁹 2. 𓁹 𓏏 𓏮 , 𓅜 𓐍 𓏏 𓁻, 𓋹 𓈖 𓐍 𓏏 𓂀  	கண் (kaṇ) 	കണ്ണ് (/kaɳɳɨ̆/), കണ്‍- (/kaɳ-/), മിഴി (/miɻi/) 	ಕಣ್ಣು 	 	 	 	 (xan)
75	nose 	ముక్కు (mukku) 	mucus@noco~nose		ముక్కు (mukku) 	𓂊, 𓂉 𓏤, 𓈙 𓂋 𓏏 𓂉 𓄹, 𓆑 𓈖 𓂧 𓂉, 𓆑 𓈖 𓆓 𓐩 𓂉	மூக்கு (mūkku) 	മൂക്ക് (/muːkkɨ̆/) 	ಮೂಗು 	 	 	 	
76	mouth 	మూతి (mūti)  வாய் (vāy)	MOUTH pheme, నోరు (nōru) 𓂋 ore@lat!	+++ ~+! <<	నోరు (nōru), మూతి (mūti) 	𓂋	வாய் (vāy) 	വായ (/ʋaːja/), വാ (/ʋaː/) 	ಬಾಯಿ 	 	 	 	 (bâ)
77	tooth (rather not molar) 	పన్ను (pannu)  (dantân)	pain;) 𓇋 𓃀 𓎛 𓄑 𓏤 ?  zwang zahn dent	<	పన్ను (pannu) 	1. 𓄑 𓏤, 1b. 𓍿 𓊃 𓏏 𓄑 2. 𓇋 𓃀 𓎛 𓄑 𓏤 3. 𓈖 𓅘 𓎛 𓂧 	பல் (pal) 	പല്ല് (/pallɨ̆/) 	ಹಲ್ಲು 	 	 	 	 (dantân)
